{
  "policy_id": "ARMILAR_ECOICOP_V2_BACKTEST_PROTOCOL_V0103",
  "policy_version": "0.10.3",
  "status": "ECOICOP_V2_BACKTEST_PROTOCOL_V0103_VALID",
  "predecessor": {
    "policy_path": "config/ecoicop_v2_transition_v0102.json",
    "policy_sha256": "8ae44a982a2ae88fa6e33c23bb95437dc4f91e0f17896190d2bbbfbaa6ff5557",
    "checker_status": "ECOICOP_V2_TRANSITION_V0102_VALID",
    "commit": "215bba966f2a376d2cd4370297512d440b0dbb7d"
  },
  "constitutional_constraints": {
    "constitution_path": "constitution/ARMILAR_RESEARCH_CORE_V1.json",
    "classification_transition_ratified": false,
    "arm_o_2026_extension_allowed": false,
    "backtest_execution_claim_allowed": false,
    "model_training_allowed": false,
    "research_release_allowed": false,
    "monetary_use_allowed": false
  },
  "scope": {
    "acquire_live_data": false,
    "acquire_2026_observations": false,
    "execute_empirical_backtest": false,
    "select_transition_strategy": false,
    "amend_constitution": false,
    "extend_arm_o": false,
    "generate_2026_targets": false,
    "define_protocol_only": true
  },
  "declared_universe": {
    "economies": [
      "DE",
      "ES",
      "FR",
      "IT",
      "PT"
    ],
    "legacy_panel_start": "2021-01",
    "legacy_panel_end": "2025-12",
    "candidate_dual_panel_earliest_start": "1996-01",
    "candidate_dual_panel_latest_end": "2025-12",
    "first_live_reference_period": "2026-01",
    "category_grain": "ECOICOP_DIVISION",
    "legacy_category_count": 12,
    "replacement_category_count": 13
  },
  "dataset_contracts": [
    {
      "role": "LEGACY_MONTHLY_INDEX",
      "provider": "EUROSTAT",
      "dataset_code": "prc_hicp_midx",
      "classification": "ECOICOP_V1_PRE_2026",
      "time_semantics": "ORIGINALLY_PUBLISHED_OR_ARCHIVED_LEGACY_SERIES",
      "permitted_period_start": "1996-01",
      "permitted_period_end": "2025-12",
      "required_units": [
        "I15"
      ],
      "acquisition_milestone": "V0104",
      "use_in_v0103": "METADATA_ONLY"
    },
    {
      "role": "LEGACY_ITEM_WEIGHTS",
      "provider": "EUROSTAT",
      "dataset_code": "prc_hicp_inw",
      "classification": "ECOICOP_V1_PRE_2026",
      "time_semantics": "ORIGINALLY_PUBLISHED_OR_ARCHIVED_LEGACY_WEIGHTS",
      "permitted_period_start": "1996",
      "permitted_period_end": "2025",
      "required_units": [
        "PC"
      ],
      "acquisition_milestone": "V0104",
      "use_in_v0103": "METADATA_ONLY"
    },
    {
      "role": "REPLACEMENT_MONTHLY_INDEX_AND_RATES",
      "provider": "EUROSTAT",
      "dataset_code": "prc_hicp_minr",
      "classification": "ECOICOP_V2_FROM_2026",
      "time_semantics": "RETROSPECTIVE_BACK_SERIES_1996_2025_AND_CURRENT_SERIES_FROM_2026",
      "permitted_period_start": "1996-01",
      "permitted_period_end": "OPEN",
      "required_units": [
        "I15",
        "I25"
      ],
      "acquisition_milestone": "V0104_OR_LATER",
      "use_in_v0103": "METADATA_ONLY"
    },
    {
      "role": "REPLACEMENT_ITEM_WEIGHTS",
      "provider": "EUROSTAT",
      "dataset_code": "prc_hicp_iw",
      "classification": "ECOICOP_V2_FROM_2026",
      "time_semantics": "RETROSPECTIVE_OR_CURRENT_WEIGHT_SERIES",
      "permitted_period_start": "1996",
      "permitted_period_end": "OPEN",
      "required_units": [
        "PC"
      ],
      "acquisition_milestone": "V0104_OR_LATER",
      "use_in_v0103": "METADATA_ONLY"
    },
    {
      "role": "REPLACEMENT_FIRST_PUBLISHED_DATA",
      "provider": "EUROSTAT",
      "dataset_code": "prc_hicp_fpd",
      "classification": "ECOICOP_V2_FROM_2026",
      "time_semantics": "FIRST_RELEASED_DATA",
      "permitted_period_start": "2026-01",
      "permitted_period_end": "OPEN",
      "required_units": [
        "I15",
        "I25"
      ],
      "acquisition_milestone": "V0107_OR_LATER",
      "use_in_v0103": "REGISTERED_NOT_ACQUIRED"
    },
    {
      "role": "CLASSIFICATION_AND_CORRESPONDENCE",
      "provider": "EUROSTAT_SHOWVOC",
      "dataset_code": "ECOICOP_V1_V2_CORRESPONDENCE",
      "classification": "ECOICOP_V1_TO_ECOICOP_V2",
      "time_semantics": "NORMATIVE_CLASSIFICATION_METADATA",
      "permitted_period_start": "NOT_APPLICABLE",
      "permitted_period_end": "NOT_APPLICABLE",
      "required_units": [
        "NOT_APPLICABLE"
      ],
      "acquisition_milestone": "V0104",
      "use_in_v0103": "REGISTERED_NOT_ACQUIRED"
    },
    {
      "role": "COUNTRY_COMPILATION_METADATA",
      "provider": "EUROSTAT",
      "dataset_code": "prc_hicp_esms",
      "classification": "COUNTRY_SPECIFIC_HICP_METADATA",
      "time_semantics": "DOCUMENTS_BACK_SERIES_COMPILATION_AND_LINKING_METHODS",
      "permitted_period_start": "NOT_APPLICABLE",
      "permitted_period_end": "NOT_APPLICABLE",
      "required_units": [
        "NOT_APPLICABLE"
      ],
      "acquisition_milestone": "V0104",
      "use_in_v0103": "REGISTERED_NOT_ACQUIRED"
    }
  ],
  "transformation_dimensions": [
    {
      "dimension_id": "CLASSIFICATION",
      "isolated": true,
      "required_comparison": "ECOICOP_V1_VS_ECOICOP_V2_AT_COMMON_PRICE_AND_WEIGHT_BASIS",
      "silent_combination_forbidden": true
    },
    {
      "dimension_id": "INDEX_REFERENCE_BASE",
      "isolated": true,
      "required_comparison": "2015_100_VS_2025_100_AFTER_EXPLICIT_REBASING_TO_COMMON_ANCHOR",
      "silent_combination_forbidden": true
    },
    {
      "dimension_id": "WEIGHTS",
      "isolated": true,
      "required_comparison": "LEGACY_WEIGHTS_VS_RECONSTRUCTED_OR_CURRENT_V2_WEIGHTS",
      "silent_combination_forbidden": true
    },
    {
      "dimension_id": "PRODUCT_COVERAGE",
      "isolated": true,
      "required_comparison": "COMMON_PRODUCT_SCOPE_VS_CHANGED_PRODUCT_SCOPE_INCLUDING_GAMES_OF_CHANCE",
      "silent_combination_forbidden": true
    },
    {
      "dimension_id": "RETROSPECTIVE_RECONSTRUCTION",
      "isolated": true,
      "required_comparison": "ORIGINALLY_PUBLISHED_INFORMATION_VS_LATER_RECONSTRUCTED_BACK_SERIES",
      "silent_combination_forbidden": true
    },
    {
      "dimension_id": "LINKING_METHOD",
      "isolated": true,
      "required_comparison": "MONTHLY_LINKING_VS_ANNUAL_LINKING_AND_ANY_DOCUMENTED_LEVEL_SHIFT",
      "silent_combination_forbidden": true
    }
  ],
  "strategies": [
    {
      "strategy_id": "T0",
      "name": "LEGACY_CLASSIFICATION_NO_TRANSITION",
      "description": "Keep the frozen ECOICOP v1 series through 2025 as the historical comparator. This strategy cannot by itself extend ARM-O into 2026.",
      "output_category_count": 12,
      "uses_reconstructed_back_series": false,
      "preserves_legacy_history": true,
      "extends_to_2026": false,
      "constitutional_decision_required": false,
      "automatic_selection_allowed": false
    },
    {
      "strategy_id": "T1",
      "name": "FULL_ECOICOP_V2_ADOPTION",
      "description": "Use the provider-native ECOICOP v2 structure with thirteen divisions and an explicit link to the current series.",
      "output_category_count": 13,
      "uses_reconstructed_back_series": true,
      "preserves_legacy_history": false,
      "extends_to_2026": true,
      "constitutional_decision_required": true,
      "automatic_selection_allowed": false
    },
    {
      "strategy_id": "T2",
      "name": "CONSTITUTIONAL_BRIDGE_TO_TWELVE_ARMILAR_CATEGORIES",
      "description": "Map ECOICOP v2 to the frozen twelve-category Armilar structure using only evidence-backed deterministic correspondence and aggregation rules.",
      "output_category_count": 12,
      "uses_reconstructed_back_series": true,
      "preserves_legacy_history": true,
      "extends_to_2026": true,
      "constitutional_decision_required": true,
      "automatic_selection_allowed": false
    },
    {
      "strategy_id": "T3",
      "name": "PARALLEL_COMPARABLE_AND_PROVIDER_NATIVE_SERIES",
      "description": "Maintain a twelve-category comparable Armilar series alongside a thirteen-division provider-native ECOICOP v2 series with explicit lineage and no silent substitution.",
      "output_category_count": 13,
      "uses_reconstructed_back_series": true,
      "preserves_legacy_history": true,
      "extends_to_2026": true,
      "constitutional_decision_required": true,
      "automatic_selection_allowed": false
    }
  ],
  "metrics": [
    {
      "metric_id": "LEVEL_DISCONTINUITY_BP",
      "unit": "BASIS_POINTS",
      "grain": [
        "STRATEGY",
        "ECONOMY",
        "LINK_PERIOD"
      ],
      "formula": "10000 * (linked_level / counterfactual_common_basis_level - 1)",
      "direction": "LOWER_ABSOLUTE_IS_BETTER",
      "required_for_completion": true
    },
    {
      "metric_id": "MONTHLY_INFLATION_DIFFERENCE_BP",
      "unit": "BASIS_POINTS",
      "grain": [
        "STRATEGY",
        "ECONOMY",
        "CATEGORY",
        "PERIOD"
      ],
      "formula": "10000 * (monthly_rate_strategy - monthly_rate_comparator)",
      "direction": "LOWER_ABSOLUTE_IS_BETTER",
      "required_for_completion": true
    },
    {
      "metric_id": "ANNUAL_INFLATION_DIFFERENCE_BP",
      "unit": "BASIS_POINTS",
      "grain": [
        "STRATEGY",
        "ECONOMY",
        "CATEGORY",
        "PERIOD"
      ],
      "formula": "10000 * (annual_rate_strategy - annual_rate_comparator)",
      "direction": "LOWER_ABSOLUTE_IS_BETTER",
      "required_for_completion": true
    },
    {
      "metric_id": "CONTRIBUTION_L1_DIFFERENCE_BP",
      "unit": "BASIS_POINTS",
      "grain": [
        "STRATEGY",
        "ECONOMY",
        "PERIOD"
      ],
      "formula": "10000 * sum(abs(category_contribution_strategy - category_contribution_comparator))",
      "direction": "LOWER_IS_BETTER",
      "required_for_completion": true
    },
    {
      "metric_id": "ECONOMY_RMSE_BP",
      "unit": "BASIS_POINTS",
      "grain": [
        "STRATEGY",
        "ECONOMY",
        "HORIZON"
      ],
      "formula": "root_mean_square(monthly_inflation_difference_bp)",